{"contract":{"execution":{"binaries":{"domains":"fb4ee6a1988357e8d47f60754d4943e77d8baa745ffb9ec4b6901dbaea73c2b6","methods":"096bae41ffc5e4f6ec8d73b0ca43f0cec83f66dda806b2d43b2d893ba07db164"},"controller_sha256":"1334777f88d34f5d5e8daf63b4a80304f3092a272bd998acdbc95b0859c359bf","dependency_policy":"physical specimen + conservative instrument/country/year context closure v1","input_sha256":"c639675612bb3e6ac78c6c6dfd623cc1c35d9ca23d83744167db684467fa62a2","models":[{"engine":"methods","grid":{"alpha":[0.0001,0.01,1.0,100.0,10000.0]},"id":"ridge_tuned_v1","method":"models.regularized.ridge","preprocessing":"raw"},{"engine":"methods","grid":{"n_components":[1,2,3]},"id":"pls_snv_v1","method":"models.pls.pls_regression","preprocessing":"snv"},{"config":{"chain_beam_width":12,"cv_n_components":false,"lambdas":[0.01],"max_chain_depth":1,"n_components":3,"primitive_bank":"compact","random_state":17,"rank":32,"top_global":8,"top_per_base":4,"top_per_family":2,"use_absorbance":false,"use_msc":false,"use_raw":true,"use_snv":true},"engine":"nirs4all","grid":{"n_components":[1,2,3]},"id":"fast_hard_v1","model":"hard_aom_chain"},{"config":{"chain_beam_width":12,"cv_n_components":false,"lambdas":[1.0],"max_chain_depth":1,"n_components":3,"primitive_bank":"compact","random_state":17,"rank":32,"sparse_mkr_max_chains":3,"top_global":8,"top_per_base":4,"top_per_family":2,"use_absorbance":false,"use_msc":false,"use_raw":true,"use_snv":true},"engine":"nirs4all","grid":{},"id":"fast_sparse_v1","model":"sparse_mkr"}],"preprocessing":"Prespecified raw, native SNV and adaptive raw/SNV operator candidates","protocol":"domains.multifamily.v0.1","providers":{"DAG-ML":"0.3.41","Methods":"1.3.6 / ABI 2.19","NumPy":"2.4.6","SciPy":"1.17.1","nirs4all":"1.4.10","sklearn":"1.7.2"},"settings":{"frozen_evaluation_id":"9830b7abe907372fa19d74578d2e46aff989eb176c13febc398cab476b2fd47f","parent_task_id":"0991a012c4244761e04beae32405424fe152b835bd653aeddd67571844b96ec6","stage_budget_task_id":"ecb4e4bafa1cddeb984b4afedf47782498b3d1f9d75f4dedeb0dde47f2b4b1ec"},"source_content_sha256":"760bfa135ac94d0e76d905a65ee9b65813c07116e7da1e1ff10d0af3cd82f5fc","split_folds_sha256":"30c3d32305534c314bf9ce66ad14fd8eaeb8085379de74cae9a07bcc8a118ef1"},"task":{"content_version":"1.0.0","dataset_id":"perten_cereals_nir","dataset_revision":"0844b0ed40b290052d89a09413e1366ad0c6f243175ae073f580e49d417e9b37","independence_policy":"physical specimen + conservative instrument/country/year context closure v1","qualification_protocol":"domains.multifamily.v0.1:9830b7abe907372fa19d74578d2e46aff989eb176c13febc398cab476b2fd47f","representation":"technical_mean","schema_version":1,"source_id":"X","split_protocol":"domains.perten.context_block_holdout.v0.1:5b6d62d90b167ad5ad547c8994da9a7e34747f85ffdff92e86a7f8431b05dc0d","target_id":"Moisture","task_id":"1ab7b0576751d6850b220e4ee0964ea74a05f653a408ad635c0141ffd99fe60e"}},"domain":"real","evidence_id":"74ecf53f1e50faa0002bc84391fabe0c4f727b16545cc5469fca863d47f54c43","execution_id":"f2223f706ade18e9a0182c397212a240d7efc0762f23634eb9c6b24994fb3294","limitations":["Two cereal closure units; conditional specimen-context bootstrap does not estimate new-cereal generalization.","Original assay/farm/donor dependencies may be unknown; no low-dependence certification.","Different candidate budgets and upstream adaptive fitting protocols; no claim of equal search effort or chemical causality."],"protocol_version":"domains.bank.v0.1","purposes":["structure_sensitive_challenge","within_population_estimator_comparison"],"qualifications":{"identity":{"reason":null,"status":"computed","value":true},"independent_support":{"reason":null,"status":"computed","value":{"observed_contexts":17,"unseen_cereal_closures":2}},"reviewed_low_dependence_candidate":{"reason":"NOT_QUALIFIED","status":"unavailable","value":null},"structural_stress":{"reason":null,"status":"computed","value":"Matched frozen designs; estimator-specific response, limited independent category support"},"xy_signal":{"reason":null,"status":"computed","value":true}},"reason":null,"schema_version":1,"scientific":{"artifacts":{"fast_hard_v1.json":{"bytes":391186,"sha256":"92b22677f15bf50d7fdf99d8589264585a8fe4fb7634bb5b358c070eff56b705"},"fast_sparse_v1.json":{"bytes":289107,"sha256":"dbb8f8c93cc0eaecbdc8e984e52fcd0ec5519b1c6638cca687c34154a672e673"},"perten-evaluation.json":{"bytes":549423,"sha256":"a99f2a51781480cb1376974b8b4c34d6d3b18d61f92baff63a042677a40a4653"},"perten-summary.json":{"bytes":55488,"sha256":"54b435a58a8d0757ce78054fad0e4eea4653e2ccb0f177f4331fc450a4cb3163"},"pls_snv_v1.json":{"bytes":239850,"sha256":"f720fad299df062baf37eb7cdee28b66fe5e873b3fe6bdd7f9aa8b3f6a5d42b5"},"ridge_tuned_v1.json":{"bytes":239410,"sha256":"2cc5830c633df110ee58b91e3ddb84d81367742844590892b2624c01ed6344aa"},"size-control-evaluation.json":{"bytes":245909,"sha256":"75f2250b771a593ac0b0b73a4b96ed0d81a8625324ebb5874f6d70c69ac5bbd8"},"size-control-results.json":{"bytes":418636,"sha256":"cb5a272f99b8619b99cd58966c907946bdf1d9826f79916b7d2f7620e58d6061"}},"availability":{"causal_shortcut_probability":"not_identifiable","conditional_component_interactions":"computed","unseen_cereal_uncertainty":"unavailable"},"membership_frozen_before_new_scores":{"evaluation_id":"9830b7abe907372fa19d74578d2e46aff989eb176c13febc398cab476b2fd47f","original_tasks":["0991a012c4244761e04beae32405424fe152b835bd653aeddd67571844b96ec6"]},"parent_alpha9_evidence_id":"e9a5d4cb6f112424e806e27280ac12306a5694f3695adbc01f78dac08776896b","parent_alpha9_task_id":"0991a012c4244761e04beae32405424fe152b835bd653aeddd67571844b96ec6","response_dimensions":["estimator_family","hyperparameter_selection","preprocessing","split_sensitivity"]},"status":"exploratory","task":{"content_version":"1.0.0","dataset_id":"perten_cereals_nir","dataset_revision":"0844b0ed40b290052d89a09413e1366ad0c6f243175ae073f580e49d417e9b37","independence_policy":"physical specimen + conservative instrument/country/year context closure v1","qualification_protocol":"domains.multifamily.v0.1:9830b7abe907372fa19d74578d2e46aff989eb176c13febc398cab476b2fd47f","representation":"technical_mean","schema_version":1,"source_id":"X","split_protocol":"domains.perten.context_block_holdout.v0.1:5b6d62d90b167ad5ad547c8994da9a7e34747f85ffdff92e86a7f8431b05dc0d","target_id":"Moisture","task_id":"1ab7b0576751d6850b220e4ee0964ea74a05f653a408ad635c0141ffd99fe60e"},"task_id":"1ab7b0576751d6850b220e4ee0964ea74a05f653a408ad635c0141ffd99fe60e"}
